id,char_diff,original_text,cleaned_text
5834,81,"Art. 1524.(NOTA : Artikel 1524 werd vervangen bij W 2000-05-29/36, art. 10, 035; Inwerkingtreding : 29-01-2011 (zie W 2000-05-29/36, art. 29), zelf vervangen bij W 2003-03-27/65, art. 4, met ingang van dezelfde datum als de wijziging bij art. 10 van de W 2000-05-29/36, (zie W 2003-03-27/65, art. 5)) Elke verzetdoende schuldeiser in het bezit van een uitvoerbare titel, krachtens dewelke bevel tot betalen is betekend, kan zich door tussenkomst van een door hem aangezochte gerechtsdeurwaarder een gewaarmerkt afschrift doen overleggen van een eerder gelegd, niet opgeheven, in rechte niet aangevochten beslag. Dit gewaarmerkt afschrift wordt afgeleverd door de gerechtsdeurwaarder die het beslag gelegd heeft, overeenkomstig de hierna vermelde vormvoorschriften. De in het eerste lid vermelde schuldeiser kan de roerende goederen en zaken vergelijken met het hem overgelegd beslag en de zaken die werden overgeslagen bij uitbreiding in beslag nemen. Heeft de verkoop niet plaats op de vastgestelde dag, dan kan de beslaglegger bij vergelijking en uitbreiding, zonder enige vordering tot indeplaatsstelling, doen overgaan tot verkoop door tussenkomst van de door hem aangezochte gerechtsdeurwaarder. De in het eerste lid vermelde schuldeiser kan eveneens en zonder enige vordering tot indeplaatsstelling, de uitvoering van zijn titel doen vervolgen door tussenkomst van een door hem aangezochte gerechtsdeurwaarder op basis van een gewaarmerkt afschrift van het eerder gelegd, niet opgeheven, in rechte niet aangevochten beslag, voorzover dit beslag niet ouder is dan drie jaar. Het proces-verbaal van beslag bij vergelijking en uitbreiding wordt aangezegd aan het bestand van berichten in de vorm van een bericht van beslag bedoeld in artikel 1390, § 1. Het beslag en in voorkomend geval de beslagen bij vergelijking en uitbreiding hebben gevolg tot op het ogenblik waarin de opheffing ervan wordt toegestaan door alle schuldeisers die beslag hebben gelegd of verzet hebben gedaan op grond van een uitvoerbare titel, krachtens dewelke reeds bevel tot betalen is betekend, met dien verstande dat de rechter zo nodig de betwistingen beslecht. De schuldeiser bedoeld in het derde lid moet in de eerste akte van verkoopdagstelling op basis van een gewaarmerkt afschrift van het eerder gelegd beslag, op straffe van nietigheid duidelijk meedelen aan de schuldenaar dat de vervolging geschiedt op basis van het eerder gelegd, niet opgeheven, in rechte niet aangevochten beslag en is gehouden het hem daartoe overgezonden gewaarmerkt afschrift op straffe van nietigheid mee te betekenen. Tussen het betekenen van deze eerste akte van verkoopdagstelling op basis van een gewaarmerkt afschrift van het eerder gelegd beslag en de verkoopdatum dient een termijn van minstens één maand te verlopen. De instrumenterende gerechtsdeurwaarder zendt in dit geval op eigen verantwoordelijkheid aan het bestand van berichten binnen drie werkdagen volgend op de handeling, overeenkomstig artikel 1390, § 1, een bericht van gemeengemaakt beslag. Dergelijk beslagbericht vermeldt naast de datum van het eerdere beslag, de identiteit van de eerdere beslagleggende schuldeiser en de identiteit van de gerechtsdeurwaarder die het heeft gelegd. De gerechtsdeurwaarders die beslag hebben gelegd zijn verplicht een register met volgnummer aan te leggen van de gewaarmerkte afschriften die zij afleveren aan de schuldeisers bedoeld in het derde lid. Deze kunnen dit gewaarmerkt afschrift enkel aanwenden ter uitvoering van de titel waarvoor het is aangevraagd.","Inwerkingtreding : 29-01-2011 (zie W 2000-05-29/36, art. 29), zelf vervangen bij W 2003-03-27/65, art. 4, met ingang van dezelfde datum als de wijziging bij art. 10 van de W 2000-05-29/36, (zie W 2003-03-27/65, art. 5)) Elke verzetdoende schuldeiser in het bezit van een uitvoerbare titel, krachtens dewelke bevel tot betalen is betekend, kan zich door tussenkomst van een door hem aangezochte gerechtsdeurwaarder een gewaarmerkt afschrift doen overleggen van een eerder gelegd, niet opgeheven, in rechte niet aangevochten beslag. Dit gewaarmerkt afschrift wordt afgeleverd door de gerechtsdeurwaarder die het beslag gelegd heeft, overeenkomstig de hierna vermelde vormvoorschriften. De in het eerste lid vermelde schuldeiser kan de roerende goederen en zaken vergelijken met het hem overgelegd beslag en de zaken die werden overgeslagen bij uitbreiding in beslag nemen. Heeft de verkoop niet plaats op de vastgestelde dag, dan kan de beslaglegger bij vergelijking en uitbreiding, zonder enige vordering tot indeplaatsstelling, doen overgaan tot verkoop door tussenkomst van de door hem aangezochte gerechtsdeurwaarder. De in het eerste lid vermelde schuldeiser kan eveneens en zonder enige vordering tot indeplaatsstelling, de uitvoering van zijn titel doen vervolgen door tussenkomst van een door hem aangezochte gerechtsdeurwaarder op basis van een gewaarmerkt afschrift van het eerder gelegd, niet opgeheven, in rechte niet aangevochten beslag, voorzover dit beslag niet ouder is dan drie jaar. Het proces-verbaal van beslag bij vergelijking en uitbreiding wordt aangezegd aan het bestand van berichten in de vorm van een bericht van beslag bedoeld in artikel 1390, § 1. Het beslag en in voorkomend geval de beslagen bij vergelijking en uitbreiding hebben gevolg tot op het ogenblik waarin de opheffing ervan wordt toegestaan door alle schuldeisers die beslag hebben gelegd of verzet hebben gedaan op grond van een uitvoerbare titel, krachtens dewelke reeds bevel tot betalen is betekend, met dien verstande dat de rechter zo nodig de betwistingen beslecht. De schuldeiser bedoeld in het derde lid moet in de eerste akte van verkoopdagstelling op basis van een gewaarmerkt afschrift van het eerder gelegd beslag, op straffe van nietigheid duidelijk meedelen aan de schuldenaar dat de vervolging geschiedt op basis van het eerder gelegd, niet opgeheven, in rechte niet aangevochten beslag en is gehouden het hem daartoe overgezonden gewaarmerkt afschrift op straffe van nietigheid mee te betekenen. Tussen het betekenen van deze eerste akte van verkoopdagstelling op basis van een gewaarmerkt afschrift van het eerder gelegd beslag en de verkoopdatum dient een termijn van minstens één maand te verlopen. De instrumenterende gerechtsdeurwaarder zendt in dit geval op eigen verantwoordelijkheid aan het bestand van berichten binnen drie werkdagen volgend op de handeling, overeenkomstig artikel 1390, § 1, een bericht van gemeengemaakt beslag. Dergelijk beslagbericht vermeldt naast de datum van het eerdere beslag, de identiteit van de eerdere beslagleggende schuldeiser en de identiteit van de gerechtsdeurwaarder die het heeft gelegd. De gerechtsdeurwaarders die beslag hebben gelegd zijn verplicht een register met volgnummer aan te leggen van de gewaarmerkte afschriften die zij afleveren aan de schuldeisers bedoeld in het derde lid. Deze kunnen dit gewaarmerkt afschrift enkel aanwenden ter uitvoering van de titel waarvoor het is aangevraagd."
5981,39,"Art. 1675/16bis. Art. 1675/16bis. § 1. Onverminderd de toepassing van artikel 1287 van het Burgerlijk Wetboek en behalve in geval van het organiseren van bedrieglijk onvermogen, kunnen natuurlijke personen die kosteloos een persoonlijke zekerheid hebben gesteld ten behoeve van de verzoeker, volledig of gedeeltelijk van hun verbintenis worden bevrijd indien de rechter vaststelt dat hun verbintenis onevenredig is met hun inkomsten en met hun vermogen. § 2. Om de in § 1 bedoelde bevrijding te genieten, legt de natuurlijke persoon die kosteloos een persoonlijke zekerheid ten behoeve van de verzoeker heeft gesteld, ter griffie van het gerecht waarbij het verzoek tot collectieve schuldenregeling is ingediend, een verklaring neer waaruit blijkt dat zijn verbintenis onevenredig is met zijn inkomsten en met zijn vermogen. Zodra deze persoon bekend is, wordt hij daartoe door de schuldbemiddelaar, bij een ter post aangetekende brief met ontvangstbewijs, in kennis gesteld van de mogelijkheid de in het eerste lid bedoelde verklaring neer te leggen. Deze kennisgeving bevat de tekst van dit artikel. § 3. De in § 2 bedoelde verklaring vermeldt de identiteit van de persoon en zijn woonplaats. De persoon voegt bij zijn verklaring : 1° het afschrift van zijn laatste aangifte in de personenbelasting; 2° de lijst van alle activa en passiva die behoren tot zijn vermogen; 3° alle andere stukken aan de hand waarvan de staat van zijn middelen en zijn lasten nauwkeurig kan worden opgemaakt. De verklaring wordt bij het dossier van collectieve schuldenregeling gevoegd. Ingeval de verklaring of de bijlagen erbij onvolledig zijn, verzoekt de rechter de persoon binnen acht dagen de vereiste nadere gegevens te verstrekken of de nodige stukken neer te leggen. § 4. De rechter doet uitspraak over de bevrijding van de persoon die de in § 2 bedoelde verklaring heeft neergelegd wanneer hij de beslissing neemt waarmee hij een minnelijke aanzuiveringsregeling homologeert of een gerechtelijke aanzuiveringsregeling beveelt. Hij kan tevens uitspraak doen op een later tijdstip, indien de behandeling van de bevrijding de beoordeling van het verzoek tot collectieve schuldenregeling kan vertragen. De rechter hoort in elk geval vooraf de verzoeker, de persoon die de in § 2 bedoelde verklaring heeft neergelegd of de betrokken schuldeisers, die overeenkomstig artikel 1675/16, § 1 worden opgeroepen. § 5. Indien de persoon voor wie de persoon bedoeld in § 1 een persoonlijke zekerheid heeft gesteld, voldoet aan de voorwaarden om een verzoek tot collectieve schuldenregeling in te dienen, doch nalaat zulks te doen, kan tevens om bevrijding worden verzocht bij de rechter die bevoegd is inzake collectieve schuldenregeling. Het verzoek is gericht tegen de hoofdschuldenaar en de schuldeiser van de verbintenis die door de in § 1 bedoelde persoon wordt gewaarborgd. Bevrijding wordt verleend indien de rechter vaststelt dat de verbintenis van de in § 1 bedoelde persoon onevenredig is met diens inkomsten en met diens vermogen. De persoon die om bevrijding verzoekt, legt tot staving van zijn verzoek, op straffe van schorsing, volgende stukken neer : 1° het afschrift van zijn laatste aangifte in de personenbelasting; 2° de lijst van alle activa of passiva die behoren tot zijn vermogen; 3° alle andere stukken aan de hand waarvan de staat van zijn middelen en zijn lasten nauwkeurig kan worden opgemaakt. De indiening van het verzoek schorst de middelen van tenuitvoerlegging ten laste van de persoon die een persoonlijke zekerheid heeft gesteld ten voordele van de hoofdschuldenaar, zulks tot over het verzoek een in kracht van gewijsde gegane beslissing wordt genomen.","Onverminderd de toepassing van artikel 1287 van het Burgerlijk Wetboek en behalve in geval van het organiseren van bedrieglijk onvermogen, kunnen natuurlijke personen die kosteloos een persoonlijke zekerheid hebben gesteld ten behoeve van de verzoeker, volledig of gedeeltelijk van hun verbintenis worden bevrijd indien de rechter vaststelt dat hun verbintenis onevenredig is met hun inkomsten en met hun vermogen. § 2. Om de in § 1 bedoelde bevrijding te genieten, legt de natuurlijke persoon die kosteloos een persoonlijke zekerheid ten behoeve van de verzoeker heeft gesteld, ter griffie van het gerecht waarbij het verzoek tot collectieve schuldenregeling is ingediend, een verklaring neer waaruit blijkt dat zijn verbintenis onevenredig is met zijn inkomsten en met zijn vermogen. Zodra deze persoon bekend is, wordt hij daartoe door de schuldbemiddelaar, bij een ter post aangetekende brief met ontvangstbewijs, in kennis gesteld van de mogelijkheid de in het eerste lid bedoelde verklaring neer te leggen. Deze kennisgeving bevat de tekst van dit artikel. § 3. De in § 2 bedoelde verklaring vermeldt de identiteit van de persoon en zijn woonplaats. De persoon voegt bij zijn verklaring : 1° het afschrift van zijn laatste aangifte in de personenbelasting; 2° de lijst van alle activa en passiva die behoren tot zijn vermogen; 3° alle andere stukken aan de hand waarvan de staat van zijn middelen en zijn lasten nauwkeurig kan worden opgemaakt. De verklaring wordt bij het dossier van collectieve schuldenregeling gevoegd. Ingeval de verklaring of de bijlagen erbij onvolledig zijn, verzoekt de rechter de persoon binnen acht dagen de vereiste nadere gegevens te verstrekken of de nodige stukken neer te leggen. § 4. De rechter doet uitspraak over de bevrijding van de persoon die de in § 2 bedoelde verklaring heeft neergelegd wanneer hij de beslissing neemt waarmee hij een minnelijke aanzuiveringsregeling homologeert of een gerechtelijke aanzuiveringsregeling beveelt. Hij kan tevens uitspraak doen op een later tijdstip, indien de behandeling van de bevrijding de beoordeling van het verzoek tot collectieve schuldenregeling kan vertragen. De rechter hoort in elk geval vooraf de verzoeker, de persoon die de in § 2 bedoelde verklaring heeft neergelegd of de betrokken schuldeisers, die overeenkomstig artikel 1675/16, § 1 worden opgeroepen. § 5. Indien de persoon voor wie de persoon bedoeld in § 1 een persoonlijke zekerheid heeft gesteld, voldoet aan de voorwaarden om een verzoek tot collectieve schuldenregeling in te dienen, doch nalaat zulks te doen, kan tevens om bevrijding worden verzocht bij de rechter die bevoegd is inzake collectieve schuldenregeling. Het verzoek is gericht tegen de hoofdschuldenaar en de schuldeiser van de verbintenis die door de in § 1 bedoelde persoon wordt gewaarborgd. Bevrijding wordt verleend indien de rechter vaststelt dat de verbintenis van de in § 1 bedoelde persoon onevenredig is met diens inkomsten en met diens vermogen. De persoon die om bevrijding verzoekt, legt tot staving van zijn verzoek, op straffe van schorsing, volgende stukken neer : 1° het afschrift van zijn laatste aangifte in de personenbelasting; 2° de lijst van alle activa of passiva die behoren tot zijn vermogen; 3° alle andere stukken aan de hand waarvan de staat van zijn middelen en zijn lasten nauwkeurig kan worden opgemaakt. De indiening van het verzoek schorst de middelen van tenuitvoerlegging ten laste van de persoon die een persoonlijke zekerheid heeft gesteld ten voordele van de hoofdschuldenaar, zulks tot over het verzoek een in kracht van gewijsde gegane beslissing wordt genomen."
6105,78,"Art. 37quinquies.( oud art. 37ter vernummerd tot nieuw art. 37quinquies) § 1. Indien een feit van die aard is om door een politiestraf of een correctionele straf gestraft te worden, kan de rechter als hoofdstraf een werkstraf opleggen. Binnen de perken van de op het misdrijf gestelde straffen, alsook van de wet op grond waarvan de zaak voor hem werd gebracht, voorziet de rechter in een gevangenisstraf of in een geldboete die van toepassing kan worden ingeval de werkstraf niet wordt uitgevoerd. De werkstraf mag niet worden uitgesproken voor de feiten : 1° die strafbaar zouden zijn met een maximumstraf van meer dan twintig jaar opsluiting als ze niet in wanbedrijven werden omgezet; 2° die bedoeld zijn in de artikelen 375 tot 377; 3° die bedoeld zijn in de artikelen 379 tot 387, indien de feiten zijn gepleegd op of met behulp van minderjarigen; 4° die bedoeld zijn in de artikelen 393 tot 397 § 2. De duur van een werkstraf bedraagt minstens twintig uren en ten hoogste driehonderd uren. Een werkstraf van vijfenveertig uren of minder is een politiestraf. Een werkstraf van meer dan vijfenveertig uren is een correctionele straf. De werkstraf moet worden uitgevoerd binnen twaalf maanden na de dag waarop de rechterlijke beslissing in kracht van gewijsde is gegaan. De probatiecommissie kan die termijn ambtshalve of op verzoek van de veroordeelde verlengen. § 3. Indien een werkstraf door de rechter wordt overwogen, door het openbaar ministerie wordt gevorderd of door de beklaagde wordt gevraagd, licht de rechter deze laatste vóór de sluiting van de debatten in over de draagwijdte van een dergelijke straf en hoort hem in zijn opmerkingen. De rechter kan hierbij eveneens rekening houden met de belangen van de eventuele slachtoffers. De rechter kan de werkstraf slechts uitspreken als de beklaagde op de terechtzitting aanwezig of vertegenwoordigd is en nadat hij, hetzij in persoon, hetzij via zijn raadsman, zijn instemming heeft gegeven. De rechter die weigert een door het openbaar ministerie gevorderde of door de beklaagde gevraagde werkstraf uit te spreken, moet zijn beslissing met redenen omkleden § 4. De rechter bepaalt de duur van de werkstraf en kan aanwijzingen geven omtrent de concrete invulling van de werkstraf. Bij veroordeling op grond van de strafrechtelijke bepalingen van de wetten van 30 juli 1981 tot bestraffing van bepaalde door racisme of xenophobie ingegeven daden, van 23 maart 1995 tot bestraffing van het ontkennen, minimaliseren, rechtvaardigen of goedkeuren van de genocide die tijdens de tweede wereldoorlog door het Duitse nationaal-socialistische regime is gepleegd, van 10 mei 2007 ter bestrijding van bepaalde vormen van discriminatie, van 10 mei 2007 ter bestrijding van discriminatie tussen vrouwen en mannen en van 22 mei 2014 ter bestrijding van seksisme in de openbare ruimte en tot aanpassing van de wet van 10 mei 2007 ter bestrijding van discriminatie tussen vrouwen en mannen teneinde de daad van discriminatie te bestraffen, kan de rechter aanwijzingen geven opdat de invulling van de werkstraf in verband zou staan met, respectievelijk, de strijd tegen het racisme of de xenofobie, de discriminatie, het seksisme en het negationisme, ter inperking van het risico op herhaling van dergelijke misdrijven","Indien een feit van die aard is om door een politiestraf of een correctionele straf gestraft te worden, kan de rechter als hoofdstraf een werkstraf opleggen. Binnen de perken van de op het misdrijf gestelde straffen, alsook van de wet op grond waarvan de zaak voor hem werd gebracht, voorziet de rechter in een gevangenisstraf of in een geldboete die van toepassing kan worden ingeval de werkstraf niet wordt uitgevoerd. De werkstraf mag niet worden uitgesproken voor de feiten : 1° die strafbaar zouden zijn met een maximumstraf van meer dan twintig jaar opsluiting als ze niet in wanbedrijven werden omgezet; 2° die bedoeld zijn in de artikelen 375 tot 377; 3° die bedoeld zijn in de artikelen 379 tot 387, indien de feiten zijn gepleegd op of met behulp van minderjarigen; 4° die bedoeld zijn in de artikelen 393 tot 397 § 2. De duur van een werkstraf bedraagt minstens twintig uren en ten hoogste driehonderd uren. Een werkstraf van vijfenveertig uren of minder is een politiestraf. Een werkstraf van meer dan vijfenveertig uren is een correctionele straf. De werkstraf moet worden uitgevoerd binnen twaalf maanden na de dag waarop de rechterlijke beslissing in kracht van gewijsde is gegaan. De probatiecommissie kan die termijn ambtshalve of op verzoek van de veroordeelde verlengen. § 3. Indien een werkstraf door de rechter wordt overwogen, door het openbaar ministerie wordt gevorderd of door de beklaagde wordt gevraagd, licht de rechter deze laatste vóór de sluiting van de debatten in over de draagwijdte van een dergelijke straf en hoort hem in zijn opmerkingen. De rechter kan hierbij eveneens rekening houden met de belangen van de eventuele slachtoffers. De rechter kan de werkstraf slechts uitspreken als de beklaagde op de terechtzitting aanwezig of vertegenwoordigd is en nadat hij, hetzij in persoon, hetzij via zijn raadsman, zijn instemming heeft gegeven. De rechter die weigert een door het openbaar ministerie gevorderde of door de beklaagde gevraagde werkstraf uit te spreken, moet zijn beslissing met redenen omkleden § 4. De rechter bepaalt de duur van de werkstraf en kan aanwijzingen geven omtrent de concrete invulling van de werkstraf. Bij veroordeling op grond van de strafrechtelijke bepalingen van de wetten van 30 juli 1981 tot bestraffing van bepaalde door racisme of xenophobie ingegeven daden, van 23 maart 1995 tot bestraffing van het ontkennen, minimaliseren, rechtvaardigen of goedkeuren van de genocide die tijdens de tweede wereldoorlog door het Duitse nationaal-socialistische regime is gepleegd, van 10 mei 2007 ter bestrijding van bepaalde vormen van discriminatie, van 10 mei 2007 ter bestrijding van discriminatie tussen vrouwen en mannen en van 22 mei 2014 ter bestrijding van seksisme in de openbare ruimte en tot aanpassing van de wet van 10 mei 2007 ter bestrijding van discriminatie tussen vrouwen en mannen teneinde de daad van discriminatie te bestraffen, kan de rechter aanwijzingen geven opdat de invulling van de werkstraf in verband zou staan met, respectievelijk, de strijd tegen het racisme of de xenofobie, de discriminatie, het seksisme en het negationisme, ter inperking van het risico op herhaling van dergelijke misdrijven"
6106,75,"Art. 37sexies.( oud art. 37quater vernummerd tot nieuw art. 37sexies) § 1. De veroordeelde verricht de werkstraf kosteloos tijdens de vrije tijd waarover hij naast zijn eventuele school- of beroepsactiviteiten beschikt. De werkstraf mag uitsluitend worden verricht bij openbare diensten van de Staat, de gemeenten, de provincies, de gemeenschappen en de gewesten, dan wel bij verenigingen zonder winstoogmerk of bij stichtingen met een sociaal, wetenschappelijk of cultureel oogmerk. De werkstraf mag niet bestaan uit een activiteit die, in de aangewezen overheidsdienst of vereniging, doorgaans door bezoldigde werknemers wordt verricht. § 2. Met het oog op de toepassing van artikel 37ter, kunnen het openbaar ministerie, de onderzoeksrechter, de onderzoeksgerechten en de vonnisgerechten aan de afdeling van de Dienst justitiehuizen van het (FOD Justitie) van het gerechtelijk arrondissement van de verblijfplaats van de inverdenkinggestelde, de beklaagde of de veroordeelde de opdracht geven een beknopt voorlichtingsverslag op te stellen en/of een maatschappelijke enquête uit te voeren. (De Koning bepaalt de nadere regels inzake het beknopt voorlichtingsrapport en de maatschappelijke enquête. Deze rapporten en deze onderzoeken mogen alleen de pertinente elementen bevatten die van aard zijn de overheid die het verzoek tot de dienst van de justitiehuizen richtte in te lichten over de opportuniteit van de overwogen maatregel of straf.) § 3. (Elke arrondissementele afdeling van de Dienst Justitiehuizen van de FOD Justitie stelt tweemaal per jaar een verslag op van bestaande activiteiten waaruit de werkstraf kan bestaan.) De afdeling bezorgt een afschrift van dit verslag aan de voorzitter van de rechtbank van eerste aanleg en aan de procureur des Konings van het betrokken arrondissement en, op eenvoudig verzoek, aan al wie van een belang kan doen blijken. (§ 4. Op federaal en lokaal niveau worden overlegstructuren inzake de toepassing van de werkstraf en de autonome probatiestraf opgericht. Deze overlegstructuren hebben tot taak de instanties die betrokken zijn bij de uitvoering van de werkstraf en de autonome probatiestraf, op regelmatige basis samen te brengen teneinde hun samenwerking te evalueren. De Koning bepaalt de nadere regels inzake de samenstelling en de werking van deze overlegstructuren.)","De veroordeelde verricht de werkstraf kosteloos tijdens de vrije tijd waarover hij naast zijn eventuele school- of beroepsactiviteiten beschikt. De werkstraf mag uitsluitend worden verricht bij openbare diensten van de Staat, de gemeenten, de provincies, de gemeenschappen en de gewesten, dan wel bij verenigingen zonder winstoogmerk of bij stichtingen met een sociaal, wetenschappelijk of cultureel oogmerk. De werkstraf mag niet bestaan uit een activiteit die, in de aangewezen overheidsdienst of vereniging, doorgaans door bezoldigde werknemers wordt verricht. § 2. Met het oog op de toepassing van artikel 37ter, kunnen het openbaar ministerie, de onderzoeksrechter, de onderzoeksgerechten en de vonnisgerechten aan de afdeling van de Dienst justitiehuizen van het (FOD Justitie) van het gerechtelijk arrondissement van de verblijfplaats van de inverdenkinggestelde, de beklaagde of de veroordeelde de opdracht geven een beknopt voorlichtingsverslag op te stellen en/of een maatschappelijke enquête uit te voeren. (De Koning bepaalt de nadere regels inzake het beknopt voorlichtingsrapport en de maatschappelijke enquête. Deze rapporten en deze onderzoeken mogen alleen de pertinente elementen bevatten die van aard zijn de overheid die het verzoek tot de dienst van de justitiehuizen richtte in te lichten over de opportuniteit van de overwogen maatregel of straf.) § 3. (Elke arrondissementele afdeling van de Dienst Justitiehuizen van de FOD Justitie stelt tweemaal per jaar een verslag op van bestaande activiteiten waaruit de werkstraf kan bestaan.) De afdeling bezorgt een afschrift van dit verslag aan de voorzitter van de rechtbank van eerste aanleg en aan de procureur des Konings van het betrokken arrondissement en, op eenvoudig verzoek, aan al wie van een belang kan doen blijken. (§ 4. Op federaal en lokaal niveau worden overlegstructuren inzake de toepassing van de werkstraf en de autonome probatiestraf opgericht. Deze overlegstructuren hebben tot taak de instanties die betrokken zijn bij de uitvoering van de werkstraf en de autonome probatiestraf, op regelmatige basis samen te brengen teneinde hun samenwerking te evalueren. De Koning bepaalt de nadere regels inzake de samenstelling en de werking van deze overlegstructuren.)"
